僇僥僑儕,No,僥僗僩崁栚,婜懸寢壥,寢壥,寢壥旛峫,旛峫
  弶婜忬懺,1,怴婯僀儞僗僩乕儖捈屻偺婲摦,Premium=false,侟,,
  弶婜忬懺,2,愝掕夋柺乽儁乕僕悢乿乽儖乕僾乿偑儘僢僋忬懺,儘僢僋怓昞帵,侟,,
  弶婜忬懺,3,彜昳壙奿偑惓偟偔昞帵偝傟傞,墌昞婰偱昞帵,侟,傑偩墌偟偐傒偰側偄,儘働乕儖偵廬偭偨昞帵偐
  攦偄愗傝峸擖,4,峸擖姰椆屻丄懄嵗偵Premium=true,僾儗儈傾儉桳岠,侟,,偦傕偦傕偺UI偲偟偰丄峸擖慜椢攚宨丄峸擖屻晛捠攚宨丄偱偄偄偺偐丠
  攦偄愗傝峸擖,5,愝掕夋柺偱儁乕僕悢曄峏壜擻,憖嶌壜擻,侟,,
  攦偄愗傝峸擖,6,儁乕僕捛壛偟偰儗僀傾僂僩攝抲,惓忢摦嶌,??,捛壛偟偨儁乕僕偵傾僾儕傪抲偔偲丄尦偺儁乕僕偵偍偄偰偨摨偠傗偮偑側偔側偭偨丅暿儁乕僕側傜傾僀僥儉廳暋偼嫋梕偡傞丅,
  攦偄愗傝峸擖,7,僔儑乕僩僇僢僩攚宨怓暥帤怓愝掕,惓忢偵斀塮,侟,,
  峸擖仺嵞僀儞僗僩乕儖,8,嵞僀儞僗僩乕儖屻丄峸擖忣曬暅尦,Premium=true,??,旕僾儗儈傾儉偺忬懺丅僞僢僾偱僟僀傾儘僌偑弌傞丅嵞搙壽嬥儃僞儞傪墴偡仺峸擖嵪傒丂偲側傞丅,
  峸擖仺嵞僀儞僗僩乕儖,9,愝掕夋柺偺崁栚偑惓忢,儁乕僕悢愝掕壜擻,侟,,
  峸擖仺嵞僀儞僗僩乕儖,10,儁乕僕儞僌偑巊偊傞,僗儚僀僾壜擻,侟,,
  峸擖仺嵞僀儞僗僩乕儖,11,儗僀傾僂僩偼暅尦偝傟側偄,婜懸摦嶌乮僶僢僋傾僢僾偐傜暅尦乯,侟,,
  僶僢僋傾僢僾/儕僗僩傾,12,僶僢僋傾僢僾弌椡,JSON僼傽僀儖嫟桳,仮,僾儕僀儞僗僩乕儖偺files偑偱側偄乮僀儞僗僩乕儖傕偝傟偰偄傞乯,
  僶僢僋傾僢僾/儕僗僩傾,13,儕僗僩傾偱儗僀傾僂僩暅尦,惓忢暅尦,,,
  僶僢僋傾僢僾/儕僗僩傾,14,儕僗僩傾偱僔儑乕僩僇僢僩怓傕暅尦,攚宨怓丒暥帤怓斀塮,,,
  拲暥僉儍儞僙儖,15,僉儍儞僙儖屻傾僾儕嵞婲摦,Premium=false,侟,,
  拲暥僉儍儞僙儖,16,2儁乕僕栚埲崀傾僋僙僗晄壜,儘僢僋,侟,,僉儍儞僙儖慜偵儁乕僕捛壛偟偰偨応崌丄僉儍儞僙儖屻丄偢偭偲儁乕僕偼堏摦偱偒傞偑巊偊側偄忬懺丅偙傟偼椙偄偺偐丅儁乕僕堏摦偱偒側偄傛偆偵偡傞傎偆偑椙偄偐丅
  拲暥僉儍儞僙儖,17,愝掕夋柺乽儁乕僕悢乿偑儘僢僋忬懺,儘僢僋怓昞帵,侟,,
  拲暥僉儍儞僙儖,18,1儁乕僕栚偺儗僀傾僂僩偼堐帩,徚偊側偄,侟,,
  拲暥僉儍儞僙儖仺摦夋,19,摦夋帇挳偱僾儗儈傾儉堦帪夝曻,Premium=true乮24h乯,,,僥僗僩偱偼5暘偵曄峏
  拲暥僉儍儞僙儖仺摦夋,20,2儁乕僕栚埲崀傾僋僙僗壜擻,僗儚僀僾壜擻,,,
  摦夋峀崘帇挳,21,峀崘帇挳姰椆屻Premium=true,24帪娫桳岠,,,偡偖桳岠偵側傞偙偲傪妋擣
  摦夋峀崘帇挳,22,儁乕僕悢曄峏丒儁乕僕捛壛壜擻,憖嶌壜擻,侟,,
  摦夋峀崘帇挳,23,儗僀傾僂僩曇廤壜擻,惓忢摦嶌,侟,,
  摦夋峀崘帇挳,24,24帪娫宱夁屻Premium=false,儘僢僋忬懺偵栠傞,,,僥僗僩偱偼5暘偵曄峏
  摦夋峀崘帇挳,25,2儁乕僕栚埲崀偑儘僢僋,傾僋僙僗晄壜,,,
  摦夋峀崘帇挳,26,捛壛偟偨儗僀傾僂僩僨乕僞偼曐帩,嵞夝曻偱昞帵偝傟傞,,,
  摦夋仺嵞僀儞僗僩乕儖,27,婜尷撪偵傾儞僀儞僗僩乕儖仺嵞僀儞僗僩乕儖,Premium幐岠乮晄壜峈椡乯,,,
  UI昞帵,28,,,,,
  UI昞帵,29,,,,,
  UI昞帵,30,,,,,
  UI昞帵,31,壙奿昞帵偑惓偟偄,墌昞婰,,,儘働乕儖偵廬偭偨昞帵偐
  僄僢僕働乕僗,32,僱僢僩儚乕僋愗抐帪偺壽嬥張棟,僄儔乕昞帵,,,
  僄僢僕働乕僗,33,壽嬥搑拞偱傾僾儕kill仺暅婣,揔愗偵張棟,,,僞僀儈儞僌僔價傾偐傕丒丒
  幚憰妋擣,34,僶僢僋傾僢僾/儕僗僩傾偑Premium昞帵,尰忬柍椏仺梫廋惓,,,
  僋儕乕儞傾僢僾,35,Toast昞帵嶍彍,杮斣價儖僪偱旕昞帵,,,
  僋儕乕儞傾僢僾,36,僨僶僢僌儘僌惍棟,揔愗側儗儀儖,,,
  僋儕乕儞傾僢僾,37,僶乕僕儑儞妋掕,1.0.10,,,
,,,,,儃僞儞僒僀僘偵懳偟偰暥帤僒僀僘偺挷惍偑傑偩旝柇丅嬻敀偑栚棫偮働乕僗偑偁傞丅,
